{
  "protocol_version": 1,
  "request_id": "req-000001",
  "session_id": "example-session",
  "actor": "codex",
  "shell": "pwsh",
  "working_directory": "C:\\Users\\Alice\\Projects\\demo",
  "script": "Get-ChildItem\n",
  "timeout_seconds": 900,
  "max_output_bytes": 1048576,
  "artifacts": [
    {
      "name": "test-results",
      "paths": ["test-results/**/*.png"]
    }
  ]
}
